{
  "envelope_version": "1.0.0",
  "register_version": "0.9.9",
  "register_hash": "sha384:52d3e76d287fea787aaa51be7cb45c9eb080e489096b2d9efe8dbb748cb518a8648a7553656b03ff596e96670ce8366e",
  "algorithm": "ML-DSA-65",
  "signer": "offline-root",
  "key_id": "heossi-register-root-001",
  "public_key_fingerprint": "sha384:28c12b58eb4b092b1252b13d04138a5af233a4516c8590296325e9ae3a79b33b9e7a95e642f5eb8f50c294f907a87f50",
  "public_key": "V9fX0f3vtdUIVaJrHl7k6lu7UPrupZJ0Qqv2QyqTs4I4CMD/0QLVkhCHS4Y9FyKbaBnApEWTOIx+5o3F2/XwMOTpV6Zt/aVC4TKW7HtlW0QRWaQPde6ct469g6MvNXdEiQ2V4rYmLO+DdT/q78o5iG26QRnABOM30/NteiIULJBrQr6mhdYCSf28R31fDCeLrNqWZMM7r4jZpqpZBpN6dqfnr2GjrPSaGzCQgCGG3f8b0H2a5OLfR31zqQhQhWO3xYq6szFklP+E+5RUU6iySqPqthLM7OCj9+iAOmRPM4mJhuHsOt2JBgjtmBUpETlGxsusYyuwuHfq7tTPx1zAHjs9nvdb0TI3Th9hQeAIhweDc6RdpCBVBIfkN6sghGPPDkQJVRxh/3M99Eg8KX6bEEO5qvYbIHKBns+k+3JZAoO32mAky8Hh95GTk6tJSXducskdv0tr/OzTNwOJTVZwwiwVwcZYsBSCk9zvG5mcp92hP3tOms0QjX21qxjzBiouTJsY4vuDHQrjYmiMYHn601axJqZAPQ+9kuJJjhaHIIQMAo07ZEmuDpmjJ+qZQFwyr1/s8o0ykABnuPZI60O9EunRW/qLuLuhxbL6c38CdEONGOwmAQsK+iemMshieoxGi6b6WkIVdEhnTF4jj+GHN6c9cJw9Suwe7I9HkyVmTNnlHH4QNsbA0Cr2GmRKmbOdffOFdkrmDadgS+C4qNbH9KVUG94l6FD7qe0LgTwNObl5vGps5rYGxswscXB/Sz5Na56VL92+/xwk36bgH3eIdTWcUmbNyBIGxu9ujDkyT5zu07Oef+cdewz0WDtGGhTpHNMSMJycJS6/gMGzB49oAJY1O91rWU9x8Hi8kJySz+yMXQhcKAjf2xOF+zu+fyZ5wAh4aN/F0JrPGz/GIu1P+qd18jACV4GsB1MOsK2ri6diqk1FG3jaHNIvA+3fKEudrvH8RiPqOvTRn+Vy4873MOPooJQ9jGk/3+2fz4zvIe2ie9SQhmaq6RXMvq0UTfccpCcTDNLHbJcGSrhNFY7GUG7/MXvvCIMNY7Fj5x9uVH1DRZ7icOTXW4ZQL2L1XT4QzzCzN6/i8pv8GkYhJ9YiLYKnCqEVD0wWml6h76IgDhfxU7x0LWSmqfWGodkhvKGNAn7Lm1nD4ASQRa71uog04tcCbJpqIlm2EUdqHSaLfBKpkcyh04L3eOZLHHP/PbKpaUndB05oPSwwYhbFE+pno65lx9JhBHlcyQ/uNsTfkh+TDVcacHic9PcXF4dCkkrvzdTN7BkEXka4qaZS1ClC+OeKh59Wcr9WfZ1PnW+eTPbuzF7/uw/LgZ0ecxidbbcK0LCohe1M9lDbmB1uS1GqQQklK8JcujX2P7TFegO+9SZs8AzBe1zdFYUVY+pdfkLJt5kM2NG3AepK1tCiKP/VTz/TdIIGLTrXaW7fMlinBN7CCP5nZshMH2Cf2Y3yZixlE642FfW3xfp9NgLaKISXtDUItjH8lE3XMIeDLTr/0wJLMgvk65x+q8HfQ+qKZf5li7rhr5yOqjtJiCHMY0PhWCxaqKqTZv4dXBljKpwLWze52OxpGDl9pXQE5DcE6ev/NjBb0SaRND4OMqddmkAxuV5nSACVrKb3ZWVuzgcCFPBxOU3G5n9HfQkQytZiaV2uyHu8vR61MNtvpSrQsxLqmHVYQ14GtJY9ZlmzNf1zdY/+SGddwbqeuVK1fDmfnDGmBn5leBr5cgh8qPI5HFqA71ViGoTzJnRnv6JcTp0WZ/s2S7enYxmTdSGg0MkoTqkaI/wiGGTROnGpmXPDxxUuRD54hjUxR32gL0SgFs39T0ShzPKWXDAefvCAzAUtuXPpZXpgV5DAs6K3DZvjkyUm3Mm0a4IX151B9Guq2ywn3bt1QmxT/6LZ0ZnoUCQk21Bfrow3QMVX8mcjwzSdHivgdK4l656kXDfQQIgDwouQbd1EHYzvAFVa4fCiz0d55aDwXIavaycr6wsSub3d0jmeh3Zb447jM+Sw1wFYE2IA3pV64rY0cNi3yH1HqXWybDY0dvZngDs/uUsoBwxp8zbDCjZgqytJ0GY5sclCGpKSVb6MNdaap6gWe8ry5opaX0QLMd8fPLp4lmrKZqe1qrlv+K+yrt3mxkr8wosSO+d/KjX0/A4G22VT4cfNqH9wHKuDm/ydNEdaCgl1J5kBGmXDmxRYOZc9/znmzlWLaYh2v2j8L8WDsOH8en+1S10n37sZV8FyH/oQ66UN8R+0ob8euPqPKNZWyAetahDCZSfDTP//1FR3Ty4cWLW1e/5C842mHHUMamuQG/SIlKwX3KohXVCnHezLSx7G5IjWRmbtZ3nURaSwha2jtwRt9UnOZhCGtVYOc6RYsWHG2aZf3DfHH9jupd6crZuD8nMfMHWHSAsmAIlLFrw1b3GseNTe4y3mC5lC4T3CrYVZwWwlnG8XAS0kkToM2/53IDzryEGGcj0OzUHTQCgIxspRJEEqRnwmmQwKRt8lzJfqjAXvxP9Ij9tp3X2gWFvSsg7i7HjtCi4L6MlyKhASnlNKIvcHjU1JRCUMXzsojOnPUc4jOAcikXu33X9CGAQdXEdinGJkO54=",
  "signature": "M0BpWu/UYXBQBL9xtOdtQ12NGnhPw/1/YwVv6Y/huEpM/72RYcPBOCOxOTZnu6cO1y9dEzqDPdInGiZDmuw543HevWEzyv5AOCuYG+Hb+MwNGlOvR37l3xLRoVRbOGzrfMA1Rtl/Z4cQGkNVQyVwWCWH0B37TX2LKPmQRgJWPK4nRz2lf+b8gGVzSppdIJAJca7fg4klvqhO91Z7muZHxre33TGQgl0lgHXJheMOrT7ozpux4NZ1RK83ldxqEzGKal/GT4HugvveFLLAbU0+C4yz6Akajk49j6q8ctyZIO95Wmsxfpi0Aqi2gsvF5CBlHHCobj+EPKqvuLVqRHAc8MBI1dSqEsHWAaC7BgKvatz7X0BoPTyClvJjDalqU3ljURjHGBw9ZTzZJc+T39QV+4V3E5Xz5vVGiOmXlgGoWOXso+06T7qXTi/jqZuDg+59DLxnFe4kQoNyeFGRMymANTzjIU7LnUi5SmwZNl47/Xm9fnoiheSgn/tTCz8LFc/NtnhfAh+vcb9yB+7G1O2rY9nBOhaBN30/y9GzLsRNSbC0VE6GqRc+l6otvObAM/+BqV0G1ukRzPaj5ddKLWSyzpampFWr6wfaboEA3Fd0Bk5iBZUMEx1CpfKkl+65si7jWc+PMvP2m+BiHGp+CuIZwJzxb0monIbNMcZxrrhYAqT2v4xCmFzokKt9YIv8kQLbrMKebmBOIUMCPWmgpfnz1AE6J6tzQnERCHC7wkxsXxAfmTXgDE8F1Frr/DidTy9MCJFn0aTuDL/BkmrabiTtxL6+00tH7Hlik/2ZAG2ARHDN/HS+mQzbA1G8xF9kVBu6yrBuNQ2NIpUqUFnuokPGzLnhYPHUPHAds3fd81xjRoHTgdGLEzXyPISZCBINe27DgNUobN7FSHe4DlpdoBLqYOZ0QDcgiPZFMTNThWcoyFLGHd0pXXk4WRJ4y7ynS86oQYFFzeO6JnjRSB0dCOeL3sBE+p3dlzFW0QNEIL3TuqQe8VjhpA3cyayqIjk/i7KAelRtqjQyiioBgnnSidzjnX3evruzs1uiPmAF45dbhOPqgKTmpubMSCYtPi36zTylDtg61tN6CquWzC0aNzZCwl2kUUe6Br5fXvuSqeOY7LkjRrthYGXHaFnz2snXLCCI3ZJbizJ6SbUyl6r/obkkuo1hHn1Vs5WSkV9GsO+xljzNGqmnBp0DQvGkYsDYBMVCrxgfPD5ZmzdlBsIbacGTeQc4mf/TpgiqKYJgK+lOdK1HCYrvO60GwxVPR+LjOg3QetF0Lu6jGKybUTLTH2V2I0/y/Ezru4tI/8sfFzos0Kg9DE2tP2V5lhyH3zH3Hg94W6/CzZ9I4O8CbmxjK5Qlb1KuYbxnqXihW6238GML0Yh7qPpajvR2UnU0Zw1lpw9yzU/QgaNtaf/MKEtxUgmfK3jySwjlP3xhQ+My6t6fM8mB+ECkZSJS93Sy1NIeLPTG51ji3Y1aVfeB3CEMt2qDQ0O55cEs48yM+WCU14W7Sm72ARD7VXQO0dK2grGOOBlMe9ZQoINg2alTyZwXdHcShLfHGqh7ChU3OiwYS1dtaX2gtaOnvMTjqNqeKnsS2gks0bHLRdNaCk72boD/73tBjjGWnSGrTaFyPH8Gz62ZYMKHVfKqJCDeAEC0/TBTPQmgSgFd5KWdG9S6lqu5LJ0RLcZ+lX+RA9GYgPX1f4Fk4+ddZqRtFQRI4D1Ph4qmlNlzNYpyXnkTHDkovTgznQ/Bezc5/EI+P9jzATN3CiSLd81KEFJM/41k/2HqO+d/lUQEO/zYYKpexPVbref/Zp1sg2WrgXB94WMKanwJqLhivi/+fspTtrSY700XdvMvI+CgdbhtlgNixc4FpRbHQ1q15F3tYuUl+Z4rvQ1B6wJkVJlcyIE6zu/9ciz5zkNoWjaLGcJLKlPNnQLKGQdPllFiGqq2z7dv2U3exaJzVU/xSYmzGXICyWwp8yKyWzmKxsz2jPbdldv8ESwGce/XdWyK6sEgfwoBKciUEkleJub/27/6WZl1Xp3zc1DNKegPFSsXyunmRRsVX4/H6So16D3axUawd2p3W6EcmnKhlz252+sEwqf9RKze9x1v55QcZ7Wh0zUv/9XkPioycVT6HkBnfVGntMkLPQhoNkESmznIBBFMDg/s3ChqgZkYt2iNiVbJw4GLe8NplSZcUKD8f8UT57goIfxXmUYqOJJtht9wikj+Y17EELAlGhaooSofgJ10iDxoo9Td87vgSUZKbLYjjOwXRKRM5xPcey+msHLeNwZA9esJS3lx1i4wz4YWbOKkSAfQnIESNy5vXgN83LMz/0l8+toAt10pVm8Q09zhVjK0SbQAOZyENIey5TFRizm6hr53LSUz4GKy3BiZfdIvZollFDSt+B4WXXPZm1CwI4imNxiJ8YyM4Ot9aeqtwq19Orxv8t2QgwemlZX/EBbpmSDgytCXuN2V2EbDQBN8V7CmEoEKrXbPab4RG3tRFCeUJkTcBcUS9twmBkTBzyUDMYrV5onugxuCQoRsEQZvP1b++9BVUewUl8ISievjE209VtzWWa6vaU1DgtIi59P1O6moa4fIJawKJRMfNyoBJqUW4+9bWV6uVoqpCu9n2z02N5J1eCYLySlsMdKL1e5K6FZ8TXpdQBCyTmRYIlOPzduykzPsnkLJQ2FAi1rmoYD7LhCuIn/3PPkVAscJoq9Vuph05MP3/hiaLo92WAdfK7mHvegZc3jmLIOdcsrRRQBzURXSD+YxQF013NDNy/B8MPnZQ5AYmLyUAP0L+C4xMydBtgMMVGhAONO3WiRL8B6rpk7ZCHxNvjUr53StagOE1kGo1BdUpDyt6qJbUJ37rEZGh09mKOIwba3uJRsUuy9tcBuWI/+GwFguoU8RwggtRzPF6IEFryx9sHYNRzOCAwAZ7w+OzuczIDBxiOd9GvR5SgzGoyNbJfpad/pPQAqbyVGpYXzeKetpdTO/V+pd787eSpvF0CYj7RTud5Ahii5NI6Axg9HeHomMK6OFDK8PGLc6cXko81L80wFhpNVGDnDAxuDUePXIM2LrTY3exmITeIElONwZKGGKzC1kLovoiEpihZO1y3yrtDKvE8IcU5r53uYrTIUoHSnJ1ZxSIia3r3j2/+BoZUQd7F+JWkVvPj7iQG9qgItiOT0apg0bSBm0UOtYzS3rM2lnqBP7YPUbu8tF66YEAyQN8Tfz/3FVajjBOYD0EdIpb3/d2wqhzg1FZZNDyRjoVXHOtdWDuD+6BsdVsU8qkzlmRtwVfK0gahMkWDMcHWXWygvUTbFm5/83VkUvMMDqZcUERdxZFKBxreoS2b8/LVIi/O8NPmuLgmN2+mG5KhNIZcShW10JU97GJCnTlflpC/iIFscrqMo+ixgmH1Wm3abYuXYIugPNwHNTWGL1BlfTXR/Cgc5Et9ZFoD1ZW3ej4kElKuVhhcegBPPY2aiDHKilNW9mMOA9jOQRxYCy1dwvpUQIbc1HnEYDclHux29Z/JzPymiGRESK/fSxkzxQXh5GXmFNs81NVW47NlsHdxDYfcW8FPW0HzXjbUtysgqPurtIDnFkMuAKAD25bP8uOqyf8zJZad+z1iCXu9+xAHwPD823SOnXz1dYGhl3emjPQ8bOA67yqLeQtOvAN3Dt5A+XT1/FhZs2KIcPmTkOy1WsS5zJaUQt9xvyUydsYJwBHGVck/Bwh5cRIIpGWDmqpPuhFoZIoJElxsUSyPNCddwrYvRtkV9r+EjXeVasjM4s0yd1OeQ7j8VoJao29jXrOf9tz+QwyBi7/ACKktROQCmf1fhA0u6/DHaj3CkZtoDfiUlNTdbZ99kkdtoFSPr6yHjUIlySI8HiUFmQldjQKuCYFPE216PF+eEl/ZNier9n7W6c/5cPekb1/ta4yM1M2jSx29K4+DctEdwgC9nVtpY0UaJZbcPIO5ypMm3vD07qdcbTTONSMUCB09PEAXHunXpMwgBOJgcC8rlgkcdzVDKkwrWc2bOiIOmNIfQ681vutJlEY9g8dPfBuw8zfBxxSE7ietYkZz9H0r7H1ZSFyZeTCWNYoZZxAhYc5AtqY9XY3afdTcvNuTt95/nQeayhjt59a8Wlw1+yVEV3/rMTZx6wX9PcqA1Q8aUJr7olcl2IxE9jHBUVzrZKWm54k/tkoLukvMfikMrsbx4xdnxGSdRnOES0+16E6e+j6+F5a5Ay04o/NUpqgmZ8SsHTj1/z34IrpDO01/myRKLPLB0UQkYvypdFaG7dNjjHHENHJibwFpMM/rsB/hD7pzg8qeCMPdqvgbSGn/eElzySYZZHoScPZ7NSI6X4Rbw9SaSmqbHT1j9NXvHz/x/oTZUDIVBbdtlNW32Fp6mstbvt9AAAAAAAAAAAAAAAAAAAAAAAAAAACA4QEhgj",
  "signed_at": "2026-07-08T15:23:51Z",
  "predecessor_envelope_hash": null
}
